{
  "quote_id": "del_aBc123XyZ",
  "pickup_name": "Example Store",
  "pickup_address": "{\"street_address\":[\"100 Maiden Ln\"],\"city\":\"New York\",\"state\":\"NY\",\"zip_code\":\"10023\",\"country\":\"US\"}",
  "pickup_phone_number": "+15555555555",
  "dropoff_name": "Example Store",
  "dropoff_address": "{\"street_address\":[\"100 Maiden Ln\"],\"city\":\"New York\",\"state\":\"NY\",\"zip_code\":\"10023\",\"country\":\"US\"}",
  "dropoff_phone_number": "+15555555555",
  "manifest_items": [
    {
      "name": {},
      "quantity": {},
      "size": {},
      "price": {},
      "must_be_upright": {},
      "weight": {},
      "vat_percentage": {}
    }
  ],
  "pickup_business_name": "Example Store",
  "pickup_latitude": 40.7066581,
  "pickup_longitude": -74.0071868,
  "pickup_notes": "Leave at the front desk.",
  "dropoff_business_name": "Example Store",
  "dropoff_latitude": 40.7066581,
  "dropoff_longitude": -74.0071868,
  "dropoff_notes": "Leave at the front desk.",
  "tip": 600,
  "external_id": "del_aBc123XyZ"
}